<?xml version="1.0" encoding="UTF-8"?>

<scene
    xmlns:xsi="http://www.w3.org/2001/XMLSchema-instance"
    xsi:noNamespaceSchemaLocation="scene.xsd"
>
  <height>600</height>
  <width>600</width>
  <precision>4</precision>
    
  <camera aperture="90">
    <position x="70" y="0" z="0" />
    <direction x="-1" y="0" z="0" />
    <up x="0" y="0" z="1" />
  </camera>

  <colors>
  </colors>

  <objects>
    <fresnelsurface>
      <base>
        <translation x="0" y="0" z="0" />
        <rotation x="0" y="31" z="45" />
        <scale x="1" y="1" z="1" />
        <diffuse />
        <uniform color="red" />
      </base>
      <a>10</a>
      <b>5</b>
      <c>20</c>
    </fresnelsurface>
  </objects>

</scene>