<?xml version="1.0" encoding="UTF-8"?>

<scene
    xmlns:xsi="http://www.w3.org/2001/XMLSchema-instance"
    xsi:noNamespaceSchemaLocation="scene.xsd"
>
  <height>600</height>
  <width>600</width>
  <precision>4</precision>
    
  <camera aperture="90">
    <position x="0" y="0" z="5" />
    <direction x="0" y="0" z="-1" />
    <up x="0" y="1" z="0" />
  </camera>

  <colors>
  </colors>

  <objects>
    <dupincyclide>
      <base>
        <translation x="0" y="0" z="0" />
        <rotation x="0" y="0" z="0" />
        <scale x="1" y="1" z="1" />
        <diffuse />
        <texturefromfile filename="./textures/astronomy/2k_moon.jpg" />
      </base>
      <a>1</a>
      <b>0.99</b>
      <c>0.2</c>
      <d>0.23</d>
    </dupincyclide>
  </objects>

</scene>